Country|Date_range|Event_url|Event_name|Event_venue_name|Venue_address|Format|Dates|Location|Entry_fees|Estimated_turnout|Categories|Frequency|Organizer|Editions|Timings|Description
Salon Marjolaine||https://10times.com/salon-marjolaine|Salon Marjolaine|Parc Floral de Paris|Parc Floral de ParisRoute de la Pyramide, 75012 ParisFrance|Trade Show|06 - 14 Nov 2021| Parc Floral de Paris, Paris, France| Paid Ticket Check Official Website| 5000 - 20,000 Visitors 100 - 500 Exhibitors | Food & BeveragesWellness, Health & Fitness|Biennial|SPAS Organisation|['Nov 2021', '', '+10 more editions']| 09:00 AM-06:00 PM |"""Business Services industry Trade fair.""Salon Marjolaine showcases the progress of the biotechnology industry in the field of agriculture, health care, industrial and bio-informatics. It provides an avenue for networking among industry players and knowledge sharing by experts in the field of biotechnology etc. in the Biotechnology industry."
Salon de la Copropriete||https://10times.com/salon-de-copropriete|Salon de la Copropriete|Paris Expo Porte de Versailles|Paris Expo Porte de Versailles1 Place de la Porte de Versailles 75015 ParisFrance|Trade Show|03 - 04 Nov 2021 | Paris Expo Porte de Versailles, Paris, France| Check Official Website| 5000 - 20,000 Visitors 100 - 500 Exhibitors | Banking & FinanceIT & Technology|Biennial|Comexposium|['Nov 2021', '+8 more editions']| 09:00 AM-06:00 PM |"""Gain knowledge about condominium sector.""The Salon de la Copropriete will focus on digital, financing & charges, trustees, works, renovation & energy, maintenance & maintenance, happy co-ownership, regulations & legal, and facilities."
Fabric Spectacle in Beaune||https://10times.com/e1zr-z09f-s0s3|Fabric Spectacle in Beaune|Palais Des Congrès De Beaune|Palais Des Congrès De Beaune19 Avenue Charles de Gaulle 21200 BeauneFrance|Trade Show|06 Nov 2021| Palais Des Congrès De Beaune, Beaune,  France| Check Official Website| 1000 - 5000 Visitors 100 - 500 Exhibitors | Apparel & Clothing|Newly Listed|Stoffen Spektakel|['Nov 2021', '']| 09:00 AM-06:00 PM |The bringing together is entirely outside of Stoffen Spektakel. We have no insight whatsoever into agreements that are made.So pay close attention to who you make this appointment with. Also keep in mind that someone may not show up. All such matters are handled outside of Stoffen Spectacle and Stoffen Spectacle is not responsible.
WORKTECH Paris||https://10times.com/worktech-malmaison|WORKTECH Paris|google-map|Venue to be announcedParis,FranceAdd Venue|Trade Show|09 Nov 2021 | Paris,  France| Free Ticket For Industry ProfessionalsCheck Official Website| 1000 - 5000 Visitors 100 - 500 Exhibitors | Business ServicesEducation & Training|Annual|Unwired Ventures|['Nov 2021', '+7 more editions']| 9:00 PM - 5:00 PM General Hours|Worktech Paris is a platform for all those involved in the future of work and the workplace as well as real estate, technology, and innovation. It attracts some of the biggest and brightest names to debate, discuss, and divulge the last thinking on the future of work and the workplace.
SantExpo||https://10times.com/phw|SantExpo|Paris Expo Porte de Versailles|Paris Expo Porte de Versailles1 Place de la Porte de Versailles 75015 ParisFrance|Trade Show|08 - 10 Nov 2021 | Paris Expo Porte de Versailles, Paris, France| Free Ticket For Industry Professionals (View Details)| 30000 Visitors 900 Exhibitors | Medical & PharmaWellness, Health & Fitness|Annual|PG Promotion|['Nov 2021', '55th Edition', '+3 more editions']| 9:00 AM - 6:00 PM (Nov 08 - Nov 09) 9:00 AM - 5:00 PM (Nov 10) |SantExpo feature products like technologies and information systems for healthcare, management, and processing of healthcare facilities. It is the show of expertise for the hospital world; materials, equipment, technologies, and services.
Annual IFIP International Conference on Network and Parallel Computing||https://10times.com/e1z0-g0z3-g7gf|Annual IFIP International Conference on Network and Parallel Computing|google-map|Venue to be announcedParis,FranceAdd Venue|Conference|03 - 05 Nov 2021 | Paris,  France| Check Official Website| 100 - 500 Delegates | IT & Technology|Not Available|De Nouvelles Architectures pour les Communications |['Nov 2021']| 09:00 AM-06:00 PM |High-Performance Computing and Big Data are two main areas where NPC will provide a dynamic forum to explore, discuss and debate state-of-the-art technology issues and challenges. High-performance computers and big-data systems are tied inextricably to the broader computing ecosystem and its designs and market adoption.
SOFCOT Congress||https://10times.com/sofcot|SOFCOT Congress|The Palais des Congres in Paris|The Palais des Congres in Paris2 Place de la Porte Maillot 75017 ParisFrance|Conference|09 - 11 Nov 2021| The Palais des Congres in Paris, Paris, France| Paid Ticket Starts from 30 EUR (View Details)| 500 - 1000 Delegates | Medical & Pharma|Annual|Eventime|['Nov 2021', '', '+6 more editions']| 09:00 AM-06:00 PM |The SOFCOT Congress focuses on the theme that is the medical decision and explores all the aspects relating to the topic of orthopedic and traumatological surgery.
Salon Vins Gastronomie||https://10times.com/gastronomie-de-saintbrieuc|Salon Vins Gastronomie|Congress and Exhibition of the Bay of Saint-Brieuc|Congress and Exhibition of the Bay of Saint-BrieucRue Pierre de Coubertin 22099 Saint-BrieucFrance|Trade Show|05 - 07 Nov 2021| Congress and Exhibition of the Bay of Saint-Brieuc, Saint-Brieuc,  France| Paid Ticket Check Official Website| 1000 - 5000 Visitors 100 - 500 Exhibitors | Food & Beverages|Annual|GL EVENTS|['Nov 2021', '', '+9 more editions']| 09:00 AM-06:00 PM |"""International exhibition for wine lovers.""Salon Vins Gastronomie will feature products like Spirits - Charcuterie, Cassoulet, ceps, confit, foie gras, cheeses, bread, spices, ham, honey, nougat, soups etc."
Nimagine||https://10times.com/nimagine-nimes-expo|Nimagine|Parc des Expositions|Parc des Expositions230 Avenue du Languedoc, 30900 NmesNimes,France|Trade Show|06 - 14 Nov 2021| Parc des Expositions, Nimes,  France| Check Official Website| 1000 - 5000 Visitors 100 - 500 Exhibitors | Fashion & BeautyHome & Office|Annual|Parc Expo Nimes|['Nov 2021', '', '+9 more editions']| 09:00 AM-06:00 PM |"""The event is focused on fashion clothing accessories,leather goods jewelry""Nimagine is the unmissable event of autumn which combines know-how, tradition and modernity. This event will display decoration, tableware, furniture, lighting, clothing, jewelry, accessories, and etc."
AEROSPACE Testing||https://10times.com/aerospace-testing-toulouse|AEROSPACE Testing|google-map|Venue to be announcedToulouse,FranceAdd Venue|Trade Show|03 - 04 Nov 2021 | Toulouse,  France| Check Official Website| 1000 - 5000 Visitors 100 - 500 Exhibitors | Education & TrainingIT & Technology|Annual|Aerospace & Security Media LLC|['Nov 2021']| 9:00 AM - 5:00 PM |AEROSPACE Testing will be the key  gathering for manufacturing and inspection professionals to learn about the latest regulations, challenges and technical developments for testing systems and products related to, flight testing, environmental testing, climatic testing, shock and vibration testing, structural testing, avionics testing, Instrumentation testing, fatigue testing, test automation, MIMO testing, wind tunnel testing and etc.
SIDO Paris||https://10times.com/e1z4-r5x2-d5gz|SIDO Paris|Palais des Congrès|Palais des Congrès2 Place de la Porte Maillot, 75017 ParisFrance|Conference|09 - 10 Nov 2021| Palais des Congrès, Paris, France| Check Official Website| up to 100 Delegates | IT & Technology|Newly Listed|Infopro Digital |['Nov 2021', '']| 09:00 AM-06:00 PM |SIDO Paris aims to bring to Paris a Tech & Uses event dedicated to the convergence of IoT, IA, XR & Robotics Technologies for strategic and operational business decision-makers. All the technological solutions to initiate your digital transformation are at SIDO.
Salon Du Chocolat Et Gourmandises - Metz||https://10times.com/salon-du-chocolat-metz|Salon Du Chocolat Et Gourmandises - Metz|Centre Foires et Congrès de Metz Métropole|Centre Foires et Congrès de Metz MétropoleMetz Congrès,, Rue de la Grange aux Bois, 57070 Metz, FranceFrance|Trade Show|06 - 07 Nov 2021 | Centre Foires et Congrès de Metz Métropole,                         Metz, France| Check Official Website| 1000 - 5000 Visitors 100 - 500 Exhibitors | Food & Beverages|Biennial|Metz Expo|['Nov 2021', '+5 more editions']| 09:00 AM-06:00 PM |Salon Du Chocolat Et Gourmandises Metz provides the attendees with an opportunity to discover gluttony in all its forms such as chocolate to chew or melt, black, white or milk, macaroons, fluted, marshmallows, nougats, champagnes and other sweets.
Sweet & Confectionery Summit||https://10times.com/sweet-confectionery-summit|Sweet & Confectionery Summit|Virtual|Virtual|Conference|03 - 04 Nov 2021| Paris,  France| Check Official Website| 220 Delegates 140 Exhibitors | Food & Beverages|Annual|Wabel|['Nov 2021', '', '+2 more editions']| 08:00 AM - 06:00 PM |The Wabel Sweet & Confectionery Summit will consist of two days to meet potential business partners during pre-matched and pre-scheduled B2B Smart Meetings™ to bring together curated buyers and vetted suppliers from the Sweet & Confectionery industry. The Wabel  Sweet & Confectionery Summit will consist of two days to meet potential business partners during pre-matched and pre-scheduled B2B Smart Meetings™ to bring together curated buyers and vetted suppliers from the Sweet & Confectionery..continue readingindustry. These real one-on-one conversations will last 20 minutes (10 min presentation + 10 min Q&A) and be held in a private meeting. We come to the summit every year which helps us buy a lot of time compared to the exhibitions we used to attend. In a short period of time, we are able to meet a lot of suppliers. We are very happy to be here, the quality, the people, the staff, everything is excellent at Wabel.
Wedding Fair Avignon||https://10times.com/wedding-fair-avignon|Wedding Fair Avignon|Parc des Expositions|Parc des ExpositionsChemin des Felons, 84140 AvignonFrance|Trade Show|06 - 07 Nov 2021| Parc des Expositions, Avignon,  France| Check Official Website| 1000 - 5000 Visitors 100 - 500 Exhibitors | Apparel & ClothingFashion & Beauty|Annual|Id Organisation|['Nov 2021', '', '+8 more editions']| 10:00 AM - 07:00 PM |Wedding Fair Avignon features wedding products and services and accessories, photography, videography, wedding cakes, bridal wear, health care and make up products etc.
The European Society for the Study of English Conference||https://10times.com/e1z4-z2hd-1r8h|The European Society for the Study of English Conference|University of Lorraine|University of Lorraine34 Cours Leopold, 54000 NancyFrance|Conference|03 - 05 Nov 2021 | University of Lorraine, Nancy,  France| Check Official Website| 100 - 500 Delegates | Education & Training|Not Available|The European Society for the Study of English|['Nov 2021']| 09:00 AM-06:00 PM |
JFN||https://10times.com/e1z5-1z3p-0zps|JFN|Lille Grand Palais|Lille Grand Palais1 Boulevard of United Cities, 59 LilleFrance|Conference|10 - 12 Nov 2021| Lille Grand Palais,                         Lille, France| Check Official Website| up to 100 Delegates | Food & Beverages|Newly Listed|SFNCM |['Nov 2021', '']| 09:00 AM-06:00 PM |
Salon Real Estate and New Home of the Sarthe||https://10times.com/real-estate-home|Salon Real Estate and New Home of the Sarthe|Centre des Expositions du Mans|Centre des Expositions du Mans1 Avenue du Parc des Expositions, 72100 Le MansFrance|Trade Show|05 - 07 Nov 2021| Centre des Expositions du Mans, Le Mans,  France| Check Official Website| 1000 - 5000 Visitors 100 - 500 Exhibitors | Building & Construction|Annual|LEO - Loire Evenement Organisation|['Nov 2021', '', '+6 more editions']| 09:00 AM-06:00 PM |"""The unique opportunity to learn and take all necessary real estate advice to buy, sell, or to build.""Salon Real Estate and New Home of the Sarthe is going to be held in Congress of Le Mans for three days. This event will focus on display of products and services related with the real estate. The exhibitors of this event will be provided with an opportunity to showcase their products and services. Visitors gathering in this event will get a chance to meet lawyers, asset managers, administrators well and financial counselors. This event will bring together funding agencies, builders, developers and craftsmen under one roof providing them with a chance communicate with one another. Salon Real Estate and New Home of the Sarthe will also offer profitable business opportunity to the participants to build new contacts and networks."
Amenago||https://10times.com/amenago|Amenago|Lille Grand Palais|Lille Grand Palais1 Boulevard of United Cities, 59 LilleFrance|Trade Show|06 - 14 Nov 2021| Lille Grand Palais, Lille, France| Check Official Website| 5000 - 20,000 Visitors 100 - 500 Exhibitors | Business Services|Annual|GL EVENTS|['Nov 2021', '', '+12 more editions']| 09:00 AM-06:00 PM |"""Home Furnishings and Decoration trade show""Amenago is the largest space entirely dedicated to decoration. The time of a weekend: shops, designers, designers, craftsmen will offer you to find the object you are missing. As the holidays approach Christmas is the opportunity to find his deco table or gift decoration for your friends or family."
International Meet on Vaccines||https://10times.com/e1z3-s1z5-d8fk|International Meet on Vaccines|Park Inn By Radisson Nice Airport|Park Inn By Radisson Nice Airport24 Rue Costes et Bellonte, 06200 Nice, FranceFrance|Conference|04 - 05 Nov 2021 | Park Inn By Radisson Nice Airport, Nice, France| Check Official Website| 100 - 500 Delegates | Medical & Pharma|Not Available|ALBEDO MEETINGS Top Rated|['Nov 2021']| 09:00 AM-06:00 PM |
Aerospace TechWeek||https://10times.com/aerospace-techweek|Aerospace TechWeek|Congress Centre and Diagora Exhibition|Congress Centre and Diagora Exhibition150 Rue Pierre Gilles de Gennes 31670 LabegeLabège,France|Trade Show|03 - 04 Nov 2021 | Congress Centre and Diagora Exhibition, Labège,  France| Check Official Website| 1000 - 5000 Visitors 100 - 500 Exhibitors | Electric & ElectronicsLogistics & Transportation|Annual|Aerospace & Security Media LLC|['Nov 2021', '+1 more edition']| 9:00 AM - 5:00 PM |Bringing together the best aspects for aerospace technology, Avionics, Connected Aircraft, Aerospace Testing, Flight Ops IT, MRO IT and Future Airborne Capability Environment (FACE), offer great connectivity between these exciting, fast moving aerospace industry sectors. Discover the latest technologies and solutions, understand more on NextGen and SESAR programs and ensure you are up-to-date with the latest issues facing the aerospace sector.
100percent DECO Show||https://10times.com/h-deco|100percent DECO Show|Lille Grand Palais|Lille Grand Palais1 Boulevard of United Cities, 59 LilleFrance|Trade Show|06 - 07 Nov 2021| Lille Grand Palais, Lille, France| Check Official Website| 1000 - 5000 Visitors 100 - 500 Exhibitors | Building & ConstructionHome & Office|Annual|GL EVENTS|['Nov 2021', '', '+4 more editions']| 09:00 AM-06:00 PM |48H will focus on design and architecture, home decor products, furniture and furnishing, and much more.
Congress of the European Society of Pediatric Otorhinolaryngology||https://10times.com/congress-of-the-european-society-of-pediatric-otor|Congress of the European Society of Pediatric Otorhinolaryngology|Palais du Pharo|Palais du Pharo58 Boulevard Charles Livon, 13007 MarseilleFrance|Conference|06 - 09 Nov 2021 | Palais du Pharo, Marseille, France| Check Official Website| 1500 Delegates 30 Exhibitors | Medical & PharmaScience & Research|Biennial|Abbey |['Nov 2021', '15th Edition']| 10:00 AM - 5:00 PM |"""Transfers, Bridges and Frontiers in Pediatric Otorhinolaryngology""The 15th Congress of the European Society of Pediatric Otorhinolaryngology brings together pediatricians, otorhinolaryngologists, researchers, and students and provides them with the opportunity to gain insights relating to the topics of Pediatric Otorhinolaryngology."
Salon de L Habitat Lamballe||https://10times.com/l-habitat|Salon de L Habitat Lamballe|Haras National de Lamballe|Haras National de LamballePlace du Champ de Foire, 22400 LamballeFrance|Trade Show|06 - 07 Nov 2021 | Haras National de Lamballe, Lamballe,  France| Free Ticket For Industry ProfessionalsCheck Official Website| 1000 - 5000 Visitors 100 - 500 Exhibitors | Building & ConstructionHome & Office|Annual|Cabinet 3X sarl|['Nov 2021', '+4 more editions']| 09:00 AM-06:00 PM |Salon de L Habitat is an event that illustrates products like construction, renovation, extensions, insulation & treatment, decoration, Interior design, joinery, heating, fireplaces & stoves, wallpaper, lighting, window blinds, insect screen,  ceramics, furniture, roofing, glass, laminate flooring, panel, remote monitoring control systems etc.
International Power Summit||https://10times.com/e12z-ss0f-pz01|International Power Summit|google-map|Venue to be announcedNice,FranceAdd Venue|Conference|10 - 11 Nov 2021| Nice,  France| Check Official Website| up to 100 Delegates | Power & Energy|Newly Listed|Arena International Events Group|['Nov 2021', '']| 09:00 AM-06:00 PM |
Fabric Spectacle||https://10times.com/fabric-pektakel-mulhouse|Fabric Spectacle|Parc Expo de Mulhouse|Parc Expo de Mulhouse120 Rue Lefebvre, 68100 MulhouseFrance|Trade Show|07 Nov 2021| Parc Expo de Mulhouse, Mulhouse,  France| Check Official Website| 5000 - 20,000 Visitors 100 - 500 Exhibitors | Apparel & Clothing|Biennial|Stoffen Spektakel|['Nov 2021', '', '+13 more editions']| 09:00 AM-06:00 PM |
Salon Studyrama Grandes Ecoles De Toulouse||https://10times.com/studyrama-toulouse|Salon Studyrama Grandes Ecoles De Toulouse|Congress Center Pierre Baudis|Congress Center Pierre Baudis31680 11 Espl. Compans Caffarelli 31000 ToulouseFrance|Trade Show|06 Nov 2021| Congress Center Pierre Baudis, Toulouse, France| Check Official Website| 1000 - 5000 Visitors 100 - 500 Exhibitors | Education & Training|Annual|Studyrama|['Nov 2021', '', '+7 more editions']| 09:30 AM - 05:30 PM General Hours|Salon Studyrama Grandes Ecoles De Toulouse is a place of exchange, where you can meet the directors of institutions or program and study leaders. They will be your direct interlocutors and will inform you about the course of the training the cost of studies, internships, outlets, insertion of the graduates expose your case, exchange on your doubts and your possible projects. You will also meet students currently in training, take the opportunity to ask them questions about student life, campus, atmosphere.
International Conference on Neurovascular and Neurodegenerative Diseases||https://10times.com/nvnd|International Conference on Neurovascular and Neurodegenerative Diseases|Virtual|Virtual|Conference|08 - 09 Nov 2021| Paris,  France| Paid Ticket Check Official Website| 120 Delegates | Medical & PharmaScience & Research|Annual|United Scientific Group|['Nov 2021', '', '+2 more editions']| 07:00 AM - 06:00 PM |"""Meet and discuss your work with esteemed researchers""International Conference on Neurovascular and Neurodegenerative Diseases conference aim is is to bring together global experts working on various aspects of neurovascular as well as neurodegenerative diseases. Neurovascular and Neurodegenerative diseases take a significant toll on the world economy and health. According to the Brain Aneurysm Foundation, cerebral aneurysms affect a predictable 6 million Americans and are accountable for around half a million deaths globally each year. As per the stats shared in the report, AƒA¢A‚a‚¬A‚A""Neurological disorders: Public health challenges,AƒA¢A‚a‚¬A‚A there are about 50 million people who suffer from epilepsy and 24 million from Dementia globally. Neurovascular and Neurodegenerative diseases affect people worldwide, irrespective of sex, age, education, or income."
Esprit Maison Esprit Jardin||https://10times.com/maison-esprit-jardin|Esprit Maison Esprit Jardin|Parc Expo Rennes|Parc Expo RennesLa Haie Gautrais, 35170 BruzRennes,France|Trade Show|05 - 08 Nov 2021| Parc Expo Rennes, Rennes, France| Paid Ticket Check Official Website| 1000 - 5000 Visitors 100 - 500 Exhibitors | Entertainment & Media|Monthly|Parc Expo Rennes Aeroport|['Nov 2021', '', '+9 more editions']| 10:00 AM - 07:00 PM |"""The habitat & decoration exhibition in France"""
Salon des Vins de France Thonon Les Bains||https://10times.com/salon-vindefrance-thononlesbains|Salon des Vins de France Thonon Les Bains|Espace Tully|Espace Tully8 Avenue des Abattoirs, 74200 Thonon-les-BainsFrance|Trade Show|05 - 07 Nov 2021| Espace Tully, Thonon-les-Bains,  France| Check Official Website| 1000 - 5000 Visitors 100 - 500 Exhibitors | Food & Beverages|Annual|Centre France Evenements|['Nov 2021', '', '+9 more editions']| 09:00 AM-06:00 PM |"""International trade exhibition for wine lovers.""Salon des Vins de France Thonon Les Bains aims to make this event a privileged meeting between quality producers and demanding consumers. It is the successful alliance of wines and dishes brought together over the editions that attract Thonon-les-Bains an audience of gourmets constantly expanded."
Salon Alpin||https://10times.com/salon-alpin|Salon Alpin|Halle Olympique Albertville|Halle Olympique Albertville15 Avenue de Winnenden, 73200Albertville,France|Trade Show|08 - 11 Nov 2021| Halle Olympique Albertville, Albertville,  France| Check Official Website| 1000 - 5000 Visitors 100 - 500 Exhibitors | Food & BeveragesHospitality|Annual|SavoiExpo|['Nov 2021', '', '+3 more editions']| 09:00 AM-06:00 PM |Salon Alpin will display of cleaning products and hygiene, industrial cleaning, bakery, pastry, confectionery, product maintenance and hygiene, ice cream, frozen food and etc.
International Conference on Food Chemistry and Technology||https://10times.com/food-science-conference-paris|International Conference on Food Chemistry and Technology|Virtual|Virtual|Conference|08 - 10 Nov 2021| Paris,  France| Paid Ticket Starts from 299 USD (View Details)| 120 Delegates 5 Exhibitors | Food & Beverages|Annual|United Scientific Group|['Nov 2021', '', '+1 more edition']| 9:00 AM - 5:00 PM (Public) |"""Food Science advances discuss here""FCT provides a unique opportunity to network with your peers and consists of highly proficient series of talks, poster presentations, workshops, discussions and networking events will keep our fellow participants engaged in learning and making new connections. This 3-day conference features the world-class renowned food scientists and will bring together experts, young researchers, education scientists, technologists and food industry representatives to debate on the latest scientific developments in the field of food chemistry and technology that helps to improve the current and future challenges in food research."
Numerical Methods and Scientific Computing||https://10times.com/e1z5-0p1k-2zds|Numerical Methods and Scientific Computing|international Center of Mathematical Meetings|international Center of Mathematical Meetings163 Avenue de Luminy 13009 MarseilleFrance|Conference|08 - 12 Nov 2021| international Center of Mathematical Meetings, Marseille, France| Check Official Website| 100 - 500 Delegates | Education & Training|Newly Listed|CIRM |['Nov 2021', '']| 09:00 AM-06:00 PM |
Innopack||https://10times.com/innopack|Innopack|Virtual|Virtual|Trade Show|25 Oct - 19 Nov 2021| Paris,  France| Check Official Website| 1000 - 5000 Visitors 100 - 500 Exhibitors | Packing & Packaging|Newly Listed|Informa Markets - London, UK|['Oct 2021', '', '+1 more edition']| 09:00 AM-06:00 PM |
Salon Gourmand||https://10times.com/normand-produits-terroir|Salon Gourmand|Parc Exposition de Rouen|Parc Exposition de Rouen46-48 Avenue des Canadiens, 76120 Le Grand-QuevillyRouen,France|Trade Show|05 - 07 Nov 2021 | Parc Exposition de Rouen, Rouen,  France| Check Official Website| 1000 - 5000 Visitors 100 - 500 Exhibitors | Food & Beverages|Annual|Rouen Normandie Tourism & Conventions|['Nov 2021', '+9 more editions']| 10:00 AM - 10:00 PM 10:00 AM - 08:00 PM 10:00 AM - 07:00 PM View More|"""A unique opportunity to discover and taste wines and local products in one place.""This event showcases various foods products, provides the attendees with the opportunity to taste beer, wine, and various other food products."
ARTS ATLANTIC||https://10times.com/arts-atlantic|ARTS ATLANTIC|Espace Encan|Espace EncanQuai Louis Prunier, 17000 La RochelleFrance|Trade Show|05 - 07 Nov 2021| Espace Encan, La Rochelle,  France| Check Official Website| 1000 - 5000 Visitors 100 - 500 Exhibitors | Business Services|Biennial|La Rochelle Tourisme & Evenements |['Nov 2021', '', '+3 more editions']| 09:00 AM-06:00 PM |ARTS ATLANTIC is a 3 day event being held from 8th November to the 10th November 2019 in La Rochelle, france. This event showcases product from Media & Advertising, Business Services industries.
EMDay||https://10times.com/emday-c-ly|EMDay|Châteauform' Campus de Cely|Châteauform' Campus de Cely2A Route de Saint-Germain, 77930 Cély, FranceFrance|Conference|08 - 09 Nov 2021| Châteauform' Campus de Cely, Cély,  France| Check Official Website| 100 - 500 Delegates | IT & Technology|Annual|EMDAY Association |['Nov 2021', '', '+1 more edition']| 09:00 AM-06:00 PM |EMDay, the biggest French event on email marketing,The place to be to answer all your questions.
