Country|Date_range|Event_url|Event_name|Event_venue_name|Venue_address|Format|Dates|Location|Entry_fees|Estimated_turnout|Categories|Frequency|Organizer|Editions|Timings|Description
Connected Aircraft||https://10times.com/connected-aircraft|Connected Aircraft|google-map|Venue to be announcedLabège,FranceAdd Venue|Conference|03 - 04 Nov 2021 | Labège,   France| Check Official Website| 100 - 500 Delegates | Logistics & TransportationIT & Technology|Annual|Aerospace & Security Media LLC|['Nov 2021', '+1 more edition']| 9:00 AM - 5:00 PM |Connected Aircraft covers all the connectivity systems that airlines use (air-to-ground and nose-to-tail) including IFC, cabin IFEC, AI, M2M, VR, connected EFBs and ETLs, airline e-Enablement processes and strategies, ancillary revenues, IoT, big data analytics, flight tracking, cyber security, application disrupters, connectivity systems for operational efficiency and connectivity for predictive maintenance.
Europe GRI||https://10times.com/gri-europe-summit|Europe GRI|InterContinental Paris - Le Grand|InterContinental Paris - Le Grand2 Rue Scribe, 75009 ParisFrance|Conference|08 - 09 Nov 2021 | InterContinental Paris - Le Grand, Paris, France| Paid Ticket Check Official Website| 9987 Delegates195 Exhibitors | Business ServicesBanking & Finance|Annual|Global Real Estate Institute|['Nov 2021', '23rd Edition', '+9 more editions']| 8:00 AM - 6:00 PM (Business) |Now in it's 23rd year, be sure to secure your participation at Europe’s exclusively senior real estate capital firepower, the platform gives unrivaled access for industry players to source and deploy capital.Participants find the discovery process for sourcing deal flow is most advantageous by welcoming the largest concentration of LP’s developers, asset owners, operators and lenders interested in all European regions and asset classes. Over two days they will engage in a series of informal roundtables where everyone can participate.
HUMANE Autumn Seminar||https://10times.com/humane-autumn-seminar-paris|HUMANE Autumn Seminar|Virtual|Virtual|Conference|04 - 05 Nov 2021| France secondary school, Paris, France| Check Official Website| 100 - 500 Delegates | Education & Training|Annual|HUMANE asbl |['Nov 2021', '+1 more edition']| 09:00 AM-06:00 PM |The theme is Sustaining public confidence in our universities: public affairs, impact and influence . Register early for what promises to be a lively event where all of our members can come together again to network as well as engage with one another around the topical theme of public affairs management.
Mobility Business||https://10times.com/mobility-business|Mobility Business|Paris Expo Porte de Versailles|Paris Expo Porte de Versailles1 Place de la Porte de Versailles 75015 ParisFrance|Trade Show|09 - 10 Nov 2021 | Paris Expo Porte de Versailles, Paris, France| Check Official Website| 5000 - 20,000 Visitors 100 - 500 Exhibitors | IT & Technology|Biennial|EContent Magazine|['Nov 2021', '+3 more editions']| 09:00 AM-06:00 PM |Mobility Business, the Internet of Things, artificial intelligence, predictive maintenance, constant connectivity, and optimized travel are rapidly changing organizations, methods, and needs. It is an event that illustrates a large selection of products like videos, interviews, news and exhibitor cards, mobile solution providers and all decision makers in project mode etc.
Gastronomy Fair||https://10times.com/salonde-gastronomie|Gastronomy Fair|Ainterexpo - Parc des Expositions|Ainterexpo - Parc des Expositions25 Avenue du Marechal Juin, 01000 Bourg-en-BresseFrance|Trade Show|10 - 14 Nov 2021| Ainterexpo - Parc des Expositions, Bourg-en-Bresse,  France| Check Official Website| 1000 - 5000 Visitors 100 - 500 Exhibitors | Food & Beverages|Annual|AINTEREXPO|['Nov 2021', '', '+5 more editions']| 09:00 AM-06:00 PM |"""Fair of Equipment and Supplies for Gastronomy and Shops""Gastronomy Fair is a true gastronomic journey that invites the meeting between the public & professionals of mouth, chefs, artisans, and producers."
Avionics||https://10times.com/avionics-toulouse|Avionics|google-map|Venue to be announcedToulouse,FranceAdd Venue|Trade Show|03 - 04 Nov 2021 | Toulouse,  France| Check Official Website| 1000 - 5000 Visitors 100 - 500 Exhibitors | Electric & ElectronicsIT & Technology|Annual|Aerospace & Security Media LLC|['Nov 2021']| 9:00 AM - 5:00 PM |Avionics is Europe’s Only dedicated exhibition & conference for the International Aviation Electronics & Avionics Community across – commercial and defence sectors, fixed wing and rotorcraft. It is the most cost-efficient opportunity to find new business, meet existing customers and showcase your products in front of a focused targeted audience of decision makers, influencers, buyers and suppliers from airlines, operators, airframers, integrators, prime contractors and avionics manufacturers. The ultimate platform for Avionics.
Brest Wedding Fair||https://10times.com/wedding-fair-and-festival-days-brest|Brest Wedding Fair|Parc des Expositions de la Penfeld|Parc des Expositions de la Penfeld29820 GuilersFrance|Trade Show|06 - 07 Nov 2021| Parc des Expositions de la Penfeld, Guilers,  France| Paid Ticket Check Official Website| 1000 - 5000 Visitors 100 - 500 Exhibitors | Apparel & ClothingFashion & Beauty|Annual|SPE Organization|['Nov 2021', '', '+7 more editions']| 10:00 AM - 07:00 PM (All) |Brest Wedding Fair, more than sixty professionals from the region will be at your disposal to make the day of your dreams come true, one that will remain etched forever. You can also see three daily parades where wedding dresses, costumes or cocktail dresses will be sublimated by the spotlights.
Martigues Habitat Fair||https://10times.com/e1z0-r2s1-x9sd|Martigues Habitat Fair|La Halle de Martigues|La Halle de MartiguesRond-Point de l'Hôtel de Ville, 13500 MartiguesFrance|Trade Show|05 - 07 Nov 2021| La Halle de Martigues, Martigues,  France| Check Official Website| up to 1000 Visitors 20 - 100 Exhibitors | Food & Beverages|Newly Listed|Deficom|['Nov 2021', '']| 09:00 AM-06:00 PM |
