Country|Date_range|Event_url|Event_name|Event_venue_name|Venue_address|Format|Dates|Location|Entry_fees|Estimated_turnout|Categories|Frequency|Organizer|Editions|Timings|Description
Symposium on the Modeling of Reactive Systems||https://10times.com/e14z-hshs-g257|Symposium on the Modeling of Reactive Systems|National Conservatory of Arts and Crafts|National Conservatory of Arts and Crafts292 Rue Saint-Martin 75003 ParisFrance|Conference|08 - 10 Nov 2021| National Conservatory of Arts and Crafts, Paris, France| Check Official Website| up to 100 Delegates | IT & Technology|Newly Listed|CNAM IIM -|['Nov 2021', '']| 09:00 AM-06:00 PM |MSR is a biennial colloquium in French which deals with the modeling, analysis and control of reactive and real-time systems. It relates more particularly to researchers and manufacturers interested in the design of applications which are based on systems of either continuous, discrete or hybrid type. MSR is a meeting place for automation engineers and computer scientists in order to confront the techniques and problems tackled by the two communities. Thus, the role of the MSR conference is to affirm the contribution of French-speaking researchers in these fields and to promote exchanges between academics and industry.
International Symposium Reproductive Biology Fruit Tree Species||https://10times.com/e1s4-r1r2-d0gk|International Symposium Reproductive Biology Fruit Tree Species|Agropolis International|Agropolis International1000 Avenue Agropolis 34000 MontpellierFrance|Conference|08 - 12 Nov 2021| Agropolis International, Montpellier, France| Check Official Website| 100 - 500 Delegates | Agriculture & Forestry|Newly Listed|INRAE |['Nov 2021', '']| 09:00 AM-06:00 PM |This Symposium will gather scientists experts in Reproductive Biology studies on fruit species, cultivated either in temperate or tropical and sub-tropical conditions. Reproductive biology is a thematic that covers key steps of the elaboration for fruit tree production, from floral induction, flower development, flowering phenology, pollination success and compatibility between cultivars to fruit set and dependencies between consecutive years of production leading to irregular bearing. We expect from this international meeting, high quality scientific exchanges and discussions on the latest results on physiological, molecular and genetic controls, environmental effects on the different phases of yield elaboration. Advances on agronomic and orchard management aiming to maintain regular cropping, pollination success and fruit set are also expected.
International Congress of Neuroimmunology||https://10times.com/isni|International Congress of Neuroimmunology|Virtual|Virtual|Conference|08 - 12 Nov 2021| Nice,  France| Check Official Website| 100 - 500 Delegates | Medical & PharmaScience & Research|Biennial|University Paul Sabatier|['Nov 2021', '', '+1 more edition']| 12:00 AM - 12:00 AM |An excellent postdoctoral research opportunity is immediately available with the laboratory of Woong-Ki Kim at Eastern Virginia Medical School to explore macrophage biology and to develop macrophage-targeted . Congratulations to Prof. Francisco Quintana - ISNI president-elect - who has been awarded the prestigious Barancik Prize for his work toward understanding what triggers multiple sclerosis and . Congratulations to Prof. Michal Schwartz - ISNI president 2016 - 2018 - who has been awarded the prestigious EMET prize in the field of Life Sciences on .
Le Salon Ob Art||https://10times.com/ob-art-salon|Le Salon Ob Art|Corum conference cente|Corum conference centeBoulevard Charles Warnery 34000Montpellier,France|Trade Show|05 - 07 Nov 2021 | Corum conference cente, Montpellier, France| Paid Ticket Check Official Website| 5000 - 20,000 Visitors 100 - 500 Exhibitors | Arts & Crafts|Annual|AAF - Ateliers dArt de France|['Nov 2021', '+7 more editions']| 09:00 AM-06:00 PM |Le Salon Ob Art will feature arts and crafts, jewelry, textiles, ceramics, art, and crafts. the table, cutlery, glassware, cabinet making, sculpture, leather goods, lighting, fashion and accessories, mosaics, headgear, engraving, restoration and heritage and etc.
International Conference Indigenous Environmental Practices as Responses to Pollution||https://10times.com/conference-indigenous-environmental-practices|International Conference Indigenous Environmental Practices as Responses to Pollution|University of Western Brittany|University of Western Brittany3 Rue des Archives 29238 BrestFrance|Conference|04 - 05 Nov 2021 | University of Western Brittany, Brest,  France| Check Official Website| 100 - 500 Delegates | Environment & Waste|Annual|James Cook University|['Nov 2021', '+1 more edition']| 09:00 AM-06:00 PM |International Conference Indigenous Environmental Practices as Responses to Pollution aims on the one hand to determine the ways in which indigenous societies perceive and interact with pollution and toxic substances that affect their territories and places of life. It is also a question of examining how reflections on waste and its recycling inform discourse on indigenous sovereignty, and how the notion of sovereignty as it is understood, lived and defined by the indigenous people nourishes and influences artistic practices that respond to contemporary environmental challenges.
Global Spine Congress||https://10times.com/e1s1-7k50-fhzx|Global Spine Congress|Paris Marriott Rive Gauche Hotel & Conference Center|Paris Marriott Rive Gauche Hotel & Conference Center17 Boulevard Saint-Jacques, 75014 ParisFrance|Conference|03 - 06 Nov 2021 | Paris Marriott Rive Gauche Hotel & Conference Center, Paris, France| Check Official Website| 100 - 500 Delegates | Medical & Pharma|Bi-annual|AO Spine International|['Nov 2021', '+1 more edition']| 09:00 AM-06:00 PM |We are thrilled to announce an all new hybrid edition of GSC 2021! In addition to our in-person congress, it will feature an online component. AO Spine's annual meeting, the Global Spine Congress (GSC) is the leading world class spine congress gathering thousands of spine surgeons worldwide.
Dijon International & Gastronomic Fair||https://10times.com/dijon-international-gastronomic|Dijon International & Gastronomic Fair|Exhibition Center and Congress Dijon|Exhibition Center and Congress Dijon3 Boulevard de Champagne 21000 DijonFrance|Trade Show|30 Oct - 11 Nov 2021| Exhibition Center and Congress Dijon, Dijon,  France| Check Official Website| 200000 Visitors 550 Exhibitors | Food & Beverages|Annual|Dijon Congrexpo|['Oct 2021', '', '+8 more editions']| 09:00 AM-06:00 PM |"""International Household Consumables & Home Supplies Industry trade fair.""Dijon International & Gastronomic Fair offers a wide choice for the professional and amateur cook alike. The event features cookery demonstrations, competitions amongst the chefs and conferences on wine."
UN/LOCODE Advisory Group Meeting||https://10times.com/e1z2-3g14-zhpg|UN/LOCODE Advisory Group Meeting|LA SALLE|LA SALLE6 Rue de l'Artisanat, 01710 Thoiry, FranceFrance|Conference|08 - 09 Nov 2021| LA SALLE, Thoiry,  France| Check Official Website| up to 100 Delegates | Logistics & Transportation|Newly Listed|United Nations Economic Commission for Europe|['Nov 2021', '']| 09:00 AM-06:00 PM |At the meeting of the UN/LOCODE Advisory Group will present and discuss important developments related to UN/LOCODE including the use of UN/LOCODE for the Agreement on Port State Measures (PSMA) by the Food and Agriculture Organization (FAO), for the European Maritime Single Window by the European Maritime Safety Agency (EMSA), and the work of the United Nations Group of Experts on Geographical Names (UNGEGN).
Savoury & Grocery Summit||https://10times.com/webel-grocery-summit|Savoury & Grocery Summit|Virtual|Virtual|Conference|03 - 04 Nov 2021| Hilton Paris Charles de Gaulle Airport, Paris, France| Check Official Website| 220 Delegates 140 Exhibitors | Food & Beverages|Annual|Wabel|['Nov 2021', '+8 more editions']| 08:30 AM - 07:00 PM 09:00 AM - 04:00 PM |"""The Grocery SUMMIT will gather 120 purchasing groups and 150 selected manufacturers.""The Wabel Savoury Grocery Summit will consist of two days to meet potential business partners during pre-matched and pre-scheduled B2B Smart Meetings™ to bring together curated buyers and vetted suppliers from the Savoury Grocery industry.These real one-on-one conversations will last 20 minutes (10 min presentation + 10 min Q&A) and be held in a private meeting. The Wabel Savoury Grocery Summit will consist of two days to meet potential business partners during pre-matched and pre-scheduled B2..continue readingB Smart Meetings™ to bring together curated buyers and vetted suppliers from the Savoury Grocery industry. These real one-on-one conversations will last 20 minutes (10 min presentation + 10 min Q&A) and be held in a private meeting. We come to the summit every year which helps us buy a lot of time compared to the exhibitions we used to attend. In a short period of time, we are able to meet a lot of suppliers. We are very happy to be here, the quality, the people, the staff, everything is excellent at Wabel."
Paris Manga & Sci-Fi Show||https://10times.com/paris-mangasci-fishow|Paris Manga & Sci-Fi Show|Paris Expo Porte de Versailles|Paris Expo Porte de Versailles1 Place de la Porte de Versailles 75015 ParisFrance|Trade Show|06 - 07 Nov 2021| Paris Expo Porte de Versailles, Paris, France| Check Official Website| 5000 - 20,000 Visitors 100 - 500 Exhibitors | Entertainment & Media|Biennial|COB AGENCY|['Nov 2021', '', '+17 more editions']| 09:00 AM-06:00 PM |"""Media and advertising exhibition in Paris.""Paris Manga & Sci-Fi Show exclusively focuses on comics and creative print cartoon varieties. The show ranks high on the popularity count, with a large number of visitors attending the show on a regular basis. Participants are offered the chance to win attractive gifts at the several exciting games and contests that are held during the show. Several topical workshops are also organized here, enhancing the worth of the event further."
Days Of The French Society Of Senology And Mammary Pathology||https://10times.com/days-french-society-senology-and-mammary|Days Of The French Society Of Senology And Mammary Pathology|Palace of Congresses and Exhibitions Nice Acropolis|Palace of Congresses and Exhibitions Nice Acropolis1 Esplanade John Fitzgerald Kennedy 06000 NiceFrance|Conference|10 - 12 Nov 2021| Palace of Congresses and Exhibitions Nice Acropolis, Nice, France| Check Official Website| up to 100 Delegates | Medical & PharmaScience & Research|Newly Listed|NICE CONVENTION AND VISITORS BUREAU OFFICIAL |['Nov 2021', '']| 09:00 AM-06:00 PM |The Days Of The French Society Of Senology And Mammary Pathology intends to develop the knowledge of the mammary gland at the national level in order to advance the diagnosis, prevention and therapeutics of all benign or malignant breast disease. It also aims to develop basic and clinical research, to stimulate work and publications, to organize meetings, to promote teaching and to coordinate the many disciplines concerned.
AEROSPACE Testing||https://10times.com/aerospace-testing|AEROSPACE Testing|google-map|Venue to be announcedToulon,FranceAdd Venue|Trade Show|03 - 04 Nov 2021 | Toulon,   France| Check Official Website| 1000 - 5000 Visitors 100 - 500 Exhibitors | Logistics & Transportation|Annual|Aerospace & Security Media LLC|['Nov 2021', '+1 more edition']| 9:00 AM - 5:00 PM |AEROSPACE Testing is the key gathering for manufacturing and inspection professionals to learn about the latest regulations, challenges and technical developments for testing systems and products related to Flight testing, Environmental testing, Climatic testing, Shock and Vibration testing, Structural testing, Avionics testing, Instrumentation testing, Fatigue testing, Test automation, MIMO testing, Wind tunnel testing, Measurement solutions, Pressure measurement, Lightning testing, Gap measurement, Air data testing, Non-destructive, Engine testing, Materials testing and Dynamics measurement.
Global Summit on Electronics & Electrical Engineering||https://10times.com/e1sk-38zx-0rk5|Global Summit on Electronics & Electrical Engineering|google-map|Venue to be announcedMarseille,FranceAdd Venue|Conference|08 - 10 Nov 2021| Marseille,  France| Check Official Website| 100 - 500 Delegates | Electric & Electronics|Newly Listed|TheScientistt |['Nov 2021', '']| 09:00 AM-06:00 PM |We are pleased to announce that the Global Summit on Electronics & Electrical Engineering (GSEEE2021), which will be held on November 08-10, 2021 at Marseille, France is a premiere and one of the highest level international academic conferences in the field of electronics and electrical engineering.The objective of GSEEE2021 is to provide a unique forum for discussion of the latest developments, refresh your knowledge and will offer plenty of networking opportunities, providing you a chance to..continue readingmeet and interact with leading researchers as well as most influential minds in the field of electronics and electrical engineering.  The conference offers a diverse scientific program covers the latest, cutting-edge developments which can change the course of science to benefit the human society. The conference consists of excellent plenary talks, keynote talks, technical sessions and workshops along with industry tech talks. Leading experts get together in this international forum to present their research and share knowledge.The Young Researchers Forum provides a great opportunity for PhD students and young postdocs to meet up in a friendly, informal and international atmosphere to discuss and exchange ideas, to get feedback on their work from leading scientists in the field.We look forward to seeing you at GSEEE2021 and welcoming you to the city of Marseille famous for its rich history, world class monuments. We encourage participants to stay for one or two days longer to enjoy the town and surrounding area offering many places of interest worth visiting.
SATIS-Screen4All||https://10times.com/satis-aubervilliers|SATIS-Screen4All|Les Docks de Paris - Chateauform|Les Docks de Paris - Chateauform87 Avenue des Magasins Généraux, 93300 Aubervilliers, FranceFrance|Trade Show|09 - 10 Nov 2021| Les Docks de Paris - Chateauform, Aubervilliers,  France| Check Official Website| 9000 Visitors 120 Exhibitors | IT & TechnologyEntertainment & Media|Annual|Génération Numérique |['Nov 2021', '', '+3 more editions']| 10:00 AM - 7:00 PM (Business) |"""Innovation at the service of video creation and consumption""SATIS-Screen4All is merging to become the largest nationwide show dedicated to the creation and technological innovation in media, entertainment, and audio-visual communication in France. As main place for discovery and new solutions and products in the areas of image, sound and IT, the event showcases a wealth of tools and services for filming, post-production, broadcasting and publication of content on all screens."
Paris Map Fair||https://10times.com/map-fair|Paris Map Fair|Paris Marriott Opera Ambassador Hotel|Paris Marriott Opera Ambassador Hotel16 Boulevard Haussmann, 75009 ParisFrance|Trade Show|06 Nov 2021| Paris Marriott Opera Ambassador Hotel, Paris, France| Free Ticket For Industry ProfessionalsCheck Official Website| 1000 - 5000 Visitors 100 - 500 Exhibitors | Science & ResearchEducation & Training|Annual|Librairie Loeb-Laroque|['Nov 2021', '', '+6 more editions']| 11:00 AM - 06:00 PM General Hours|Paris Map Fair will feature merchants of scientific instruments that will present objects specifically dedicated to the navy and cartography. Visitors will be able to discover on the show, compasses, astrolabes, sextants or terrestrial and celestial globes. Exhibitors in ancient cartography will present on their side maps including maps, maps of Paris, views, atlases from the sixteenth to the nineteenth century.
International Conference on Relational and Algebraic Methods in Computer Science||https://10times.com/e1zg-5df0-k5s6|International Conference on Relational and Algebraic Methods in Computer Science|international Center of Mathematical Meetings|international Center of Mathematical Meetings163 Avenue de Luminy 13009 MarseilleFrance|Conference|02 - 05 Nov 2021 | international Center of Mathematical Meetings, Marseille, France| Check Official Website| up to 100 Delegates | IT & Technology|Not Available|Computer Science and Systems Laboratory |['Nov 2021', '19th Edition']| 09:00 AM-06:00 PM |Theoretical aspects include semigroups, residuated lattices, semirings, Kleene algebras, relation algebras, quantales and other algebras; their connections with program logics and other logics; their use in the theories of automata, concurrency, formal languages, games, networks and programming languages; the development of algebraic, algorithmic, category-theoretic, coalgebraic and proof-theoretic methods for these theories; their formalisation with theorem provers.
Global Summit on Catalysis, Chemical Engineering and Technology||https://10times.com/e11s-rfhg-3z29|Global Summit on Catalysis, Chemical Engineering and Technology|google-map|Venue to be announcedMarseille,FranceAdd Venue|Conference|08 Nov 2021 | Marseille,  France| Paid Ticket Starts from 669 USD (View Details)| 50 Delegates 10 Exhibitors | Miscellaneous|Annual|TheScientistt |['Nov 2021']| 9:00 AM - 6:00 PM Public Hours|This event is launched with the aims to become an established event, attracting global participants, intent on sharing, exchanging and exploring new avenues of catalysis and chemical engineering -related scientific and commercial developments.A wide-ranging scientific program consisting of plenary lectures, keynote lectures, Invited lectures, parallel sessions, as well as poster sessions for young scientists covering all topics in catalysis and chemical engineering will be scheduled. This conference provides a wonderful opportunity for you to enhance your knowledge about the newest interdisciplinary approaches in catalysis and chemical engineering.
SIDO Lyon - IoT, AI, Robotics & XR||https://10times.com/e14z-zz9p-d1k4|SIDO Lyon - IoT, AI, Robotics & XR|Palais des Congres|Palais des Congres159 St. Antoine West, 9th floor MontrÃ©al (QuÃ©bec) H2Z 1H2, CANADA - See more at: http://congresmtl.com/en/contact-us/#sthash.96bytfk8.dpufParis,France|Conference|09 - 10 Nov 2021| Palais des Congres, Paris, France| Check Official Website| 100 - 500 Delegates | IT & Technology|Quarterly|SIDO Lyon |['Nov 2021', '', '+1 more edition']| 09:00 AM-06:00 PM |
International Meet on Public Health and Healthcare Management||https://10times.com/e1zs-z15s-p52g|International Meet on Public Health and Healthcare Management|Novotel Nice Arénas Aéroport|Novotel Nice Arénas Aéroport455 Prom. des Anglais, 06200 Nice, FranceFrance|Conference|04 - 06 Nov 2021 | Novotel Nice Arénas Aéroport, Nice, France| Check Official Website| up to 100 Delegates | Medical & PharmaWellness, Health & Fitness|Not Available|ALBEDO MEETINGS Top Rated|['Nov 2021']| 09:00 AM-06:00 PM |PUBLICHEALTHMEET goal is to bring together, a multi-disciplinary group of scientists and researchers from all over the world to present and exchange break-through ideas relating to the Healthcare Management. It promotes top level research and to globalize the quality research in general, thus making discussions, presentations more internationally competitive and focusing attention on the recent outstanding achievements in the field of Public Health and Healthcare Management.
Hotel & Restaurant Meetings||https://10times.com/hotel-restaurant-meetings|Hotel & Restaurant Meetings|Palais des Festivals|Palais des Festivals1 Boulevard de la Croisette 06400 CannesFrance|Trade Show|08 - 09 Nov 2021| Palais des Festivals, Cannes, France| Check Official Website| 1000 - 5000 Visitors 100 - 500 Exhibitors | Hospitality|Annual|Weyou Group Renowned|['Nov 2021', '', '+3 more editions']| 10:00 PM - 6:00 AM |Hotel & Restaurant Meetings is a business fair designed for hotel and restaurant professionals whose aim is to promote direct face to face meetings between Top-Decision-Makers and exhibitors through business meetings pre-organized and ultra qualified before the event in a relaxed atmosphere.
Humanitarian Studies Conference||https://10times.com/e15z-hk8g-5gz3|Humanitarian Studies Conference|Virtual|Virtual|Conference|03 - 05 Nov 2021| Paris,  France| Check Official Website| 500 - 1000 Delegates | Education & Training|Not Available|ISS |['Nov 2021']| 09:00 AM-06:00 PM |The conference themes are Health and the Environment, Localising Humanitarian Studies, Political Economy and Politics of Humanitarianism, Technology and Innovation, Migration, Displacement and Refugees.
Mare di Moda||https://10times.com/maredimoda|Mare di Moda|Palais des Festivals|Palais des Festivals1 Boulevard de la Croisette 06400 CannesFrance|Trade Show|09 - 11 Nov 2021| Palais des Festivals, Cannes, France| Free & Paid Ticket Exhibit Booth Cost Starts from 450 EUR (View Details)| 3000 Visitors 110 Exhibitors | Apparel & Clothing|Biennial|MAREDIMODA|['Nov 2021', '', '+7 more editions']| 09:00 AM - 06:00 PM (Business) 09:00 AM - 04:00 PM |"""Elastic fabrics and trims show""The MarediModa Fair, which takes place every year in Cannes since 2002, is the most important event for the premiere presentation of the collections of fabrics and accessories for the beachwear, underwear and athleisure sectors. It boasts an international presence of exhibitors and visitors that continues to grow year after year. Also for this reason, it is a fundamental appointment for professionals in terms of contacts, exchanges, business and new business. To keep up with the sudden changes in the market, the MarediModa exhibition in Cannes is constantly evolving. Since 2007, it has offered its guests a space dedicated to garments for third parties in the Euro Med area and in Italy. To offer a partnership not only to fabric suppliers, but also to those involved in the packaging of the finished garment."
Wedding Fairs||https://10times.com/wedding-fair-and-life|Wedding Fairs|Parc Expo de Mulhouse|Parc Expo de Mulhouse120 Rue Lefebvre, 68100 MulhouseFrance|Trade Show|06 - 07 Nov 2021| Parc Expo de Mulhouse, Mulhouse,  France| Paid Ticket Check Official Website| 1000 - 5000 Visitors 100 - 500 Exhibitors | Apparel & ClothingFashion & Beauty|Bi-annual|YOrganisation|['Nov 2021', '', '+8 more editions']| 10:00 AM - 06:30 PM 10:00 AM - 06:00 PM |Wedding Fair and Life Mulhouse provides attendees with the opportunity to meet with wedding professionals who will provide them with the information regarding everything needed to plan a perfect wedding starting from dresses to photography, cars, shoes, stag parties, invitations, catering, marquees, harpists, rings, candy carts venue decor, singers, hen party ideas, photobooths, flowers, camper vans, celebrants, musicians, hair and make up and much more.
Financial Legal and HR Meeting||https://10times.com/finance-and-rh-meeting|Financial Legal and HR Meeting|Palais des Festivals|Palais des Festivals1 Boulevard de la Croisette 06400 CannesFrance|Conference|07 - 09 Nov 2021| Palais des Festivals,                         Cannes, France| Check Official Website| 100 - 500 Delegates | Banking & Finance|Annual|Weyou Group Renowned|['Nov 2021', '', '+3 more editions']| 9:00 PM - 5:00 AM |Finance and RH Meeting is a business fair dedicated to Finance and Human Resources professionals whose objective is to promote Top Decision Makers and Exhibitors through pre-organized appointments and highly qualified in upstream of the event in a relaxed and warm atmosphere.
The Wedding Fairs Chambery||https://10times.com/les-salons-du-mariage-chambery|The Wedding Fairs Chambery|Savoiexpo|Savoiexpo1725 Avenue du Grand Arietaz, 73000 ChamberyChambéry,France|Trade Show|06 - 07 Nov 2021| Savoiexpo, Chambéry,  France| Check Official Website| 5000 - 20,000 Visitors 100 - 500 Exhibitors | Apparel & ClothingFashion & Beauty|Annual|C M J Publicite Edition|['Nov 2021', '', '+7 more editions']| 09:00 AM-06:00 PM |
International Conference on Control, Automation and Diagnosis||https://10times.com/e12s-xh2x-s4z6|International Conference on Control, Automation and Diagnosis|Polytech Grenoble|Polytech Grenoble14 Place du Conseil National de la Résistance, 38400 Saint-Martin-d'Hères, FranceGrenoble,France|Conference|03 - 05 Nov 2021 | Polytech Grenoble,                         Grenoble, France| Check Official Website| 100 - 500 Delegates | Industrial Engineering|Quarterly|ICCAD'20 |['Nov 2021', '+1 more edition']| 09:00 AM-06:00 PM |
Epoqu Auto||https://10times.com/epoqu-auto-lyon|Epoqu Auto|Eurexpo Lyon|Eurexpo LyonAvenue Louis Blériot 69680 ChassieuLyon,France|Trade Show|05 - 07 Nov 2021 | Eurexpo Lyon, Lyon, France| Check Official Website| 5000 - 20,000 Visitors 100 - 500 Exhibitors | Auto & Automotive|Annual|Amateurs d Automobiles Anciennes|['Nov 2021', '+9 more editions']| 09:00 AM-06:00 PM |"""International trade fair for automotive industry.""Epoqu Auto will feature Merchants collection vehicles, spare parts specialists, craftsmen, sellers miniatures, antique toys, vintage clothing, automakers, collection vehicles of insurers and etc."
